[
 {
  "que_esta_pasando": "Desde las 13:30 el portal responde muy lento (p95 de 20 a 27 s) y entre 13 % y 20 % de las peticiones fallan con error 500, sobre todo al iniciar y confirmar pagos.",
  "impacto": {
   "descripcion": "Clientes no pueden iniciar ni confirmar pagos en el ultimo dia del plazo; unas 180 peticiones cada 5 minutos afectadas por lentitud o error.",
   "severidad": "critica"
  },
  "hipotesis": [
   {
    "descripcion": "Bloqueo en la base de datos SQL Server provoca los timeouts.",
    "probabilidad": "alta",
    "evidencia": [
     {
      "id": "E07",
      "cita": "Deadlock detectado en SQL Server"
     },
     {
      "id": "E99",
      "cita": "SQL timeout"
     }
    ]
   }
  ],
  "accion_sugerida": {
   "runbook": "RB-05",
   "justificacion": "Escalar a infraestructura por problema de base de datos."
  },
  "confianza": "alta",
  "datos_faltantes": [
   "La alerta reporta 23.4 % pero el recalculo desde los logs da 12.8 % (E02): revisar la consulta de la alerta."
  ]
 }
]